{
  "schema_version": "1.0",
  "skill_id": "prepare-a-replacement-shipment-draft-from-a-support-ticket",
  "revision": 1,
  "title": "Prepare a replacement shipment draft from a support ticket",
  "objective": "Prepare a replacement shipment draft from a support ticket.",
  "parameters": [
    {
      "name": "customer_shipping_address",
      "type": "private_token",
      "visibility": "private",
      "required": true,
      "binding_role": "customer_shipping_address",
      "token_class": "ADDRESS",
      "source_token_hashes": [
        "7e34f5e0d8af2ed1d1347b91a042a61c95ed002268a24bb674a3fcd2a5f9486a"
      ]
    },
    {
      "name": "order_id",
      "type": "string",
      "visibility": "public",
      "required": true,
      "binding_role": "order_id",
      "token_class": null,
      "source_token_hashes": []
    }
  ],
  "preconditions": [
    "Open the source task in the current workspace and inspect its current state."
  ],
  "required_capabilities": [
    "observe",
    "navigate",
    "type",
    "select",
    "click"
  ],
  "steps": [
    {
      "step_id": "step-cef7fc13a3818093",
      "goal": "Reach Replacement shipment form",
      "preconditions": [
        "Current recorded context: Replacement requested for order {{order_id}}. Customer shipping address is protected."
      ],
      "instruction": "Open the workflow for Replacement shipment form in shipping and confirm that its current form or page is ready.",
      "target_hints": [
        "Replacement shipment form",
        "Application: shipping"
      ],
      "postcondition": "Confirm the current run reaches this state: Replacement shipment form is open.",
      "check_ids": [],
      "recovery": [],
      "evidence_ids": [
        "e3",
        "e1",
        "e4"
      ],
      "basis": "observed",
      "open_questions": []
    },
    {
      "step_id": "step-43700797e2f9d4ad",
      "goal": "Populate Order reference",
      "preconditions": [
        "Current recorded context: Replacement shipment form is open."
      ],
      "instruction": "Locate the editable field for Order reference in shipping and enter {{order_id}}. Use the current run's input and compare the populated field with that input before continuing.",
      "target_hints": [
        "Order reference",
        "Application: shipping",
        "Identify the field by its label and purpose in the current layout."
      ],
      "postcondition": "Confirm the current run reaches this state: Order reference {{order_id}} is present. Verify that Order reference matches the current input {{order_id}}.",
      "check_ids": [],
      "recovery": [],
      "evidence_ids": [
        "e5",
        "e4",
        "e6"
      ],
      "basis": "observed",
      "open_questions": []
    },
    {
      "step_id": "step-c996ee030afc07d5",
      "goal": "Set the requested choice for Replacement item",
      "preconditions": [
        "Inspect the current form and the source task.",
        "Recorded source guidance: Select the replacement item shown on the support ticket before preparing the draft."
      ],
      "instruction": "Locate Replacement item in shipping, select Replacement item, and confirm that the selection is retained.",
      "target_hints": [
        "Replacement item",
        "Application: shipping",
        "Identify the field by its label and purpose in the current layout."
      ],
      "postcondition": "Confirm the current run reaches this state: Replacement item is selected.",
      "check_ids": [],
      "recovery": [],
      "evidence_ids": [
        "e10",
        "e8",
        "e11",
        "e9"
      ],
      "basis": "observed",
      "open_questions": []
    },
    {
      "step_id": "step-09c5ad78abd48464",
      "goal": "Populate Customer shipping address",
      "preconditions": [
        "Current recorded context: Replacement item is selected."
      ],
      "instruction": "Locate the editable field for Customer shipping address in shipping and enter {{customer_shipping_address}}. Use the current run's input and compare the populated field with that input before continuing.",
      "target_hints": [
        "Customer shipping address",
        "Application: shipping",
        "Identify the field by its label and purpose in the current layout."
      ],
      "postcondition": "Confirm the current run reaches this state: Shipping address field contains the protected customer shipping address. Verify that Customer shipping address matches the current input {{customer_shipping_address}}.",
      "check_ids": [
        "c1"
      ],
      "recovery": [],
      "evidence_ids": [
        "e12",
        "e11",
        "e13"
      ],
      "basis": "observed",
      "open_questions": []
    },
    {
      "step_id": "step-ac2efa860155f34c",
      "goal": "Complete the recorded transition for Prepare draft",
      "preconditions": [
        "Current recorded context: Shipping address field contains the protected customer shipping address."
      ],
      "instruction": "Locate the control whose function is Prepare draft in shipping. Activate it once, then inspect the resulting state before taking another action.",
      "target_hints": [
        "Prepare draft",
        "Application: shipping",
        "Identify the control by its function and resulting state; its label may differ."
      ],
      "postcondition": "Confirm the current run reaches this state: Replacement shipment draft ready for review. Order, replacement item, and destination are populated.",
      "check_ids": [
        "c2"
      ],
      "recovery": [
        {
          "instruction": "If the current form shows the recorded error: Validation message: select the replacement item. \u2014 Select the replacement item shown on the support ticket before preparing the draft. Recheck the corrected state before continuing.",
          "basis": "user_confirmed",
          "evidence_ids": [
            "e9",
            "e7",
            "e8"
          ]
        }
      ],
      "evidence_ids": [
        "e16",
        "e13",
        "e17"
      ],
      "basis": "observed",
      "open_questions": []
    }
  ],
  "checks": [
    {
      "check_id": "c1",
      "criterion": "Destination value equals the selected source value.",
      "source": "core_verifier",
      "result": "passed",
      "evidence_ids": [
        "e14",
        "e1",
        "e12",
        "e13"
      ],
      "basis": "observed"
    },
    {
      "check_id": "c2",
      "criterion": "Draft contains the selected order, replacement item, and matching shipping destination; no purchase was made.",
      "source": "core_verifier",
      "result": "passed",
      "evidence_ids": [
        "e18",
        "e6",
        "e11",
        "e13",
        "e16",
        "e17"
      ],
      "basis": "observed"
    }
  ],
  "unresolved_questions": [],
  "source_recording_ids": [
    "recording-demo-001"
  ],
  "generation": {
    "mode": "mock",
    "model": null,
    "bundle_digest": "f30102df4e272d2f29e437e0b9670b32680aa63591365b674f35095ac0e74b6b",
    "window_count": 1,
    "warnings": [
      "Live changed-workspace execution has not been tested."
    ]
  },
  "review": {
    "status": "candidate",
    "accepted_revision": null
  },
  "validation_status": "candidate"
}
